{
  "metadata": {
    "timestamp": "2025-05-30T23:13:41.116166",
    "operation": "materials_summary"
  },
  "data": {
    "thinking": "I systematically analyzed the Azure CNI Powered by Cilium documentation. First, I identified this as a technical implementation guide focused on configuring Azure CNI with Cilium in Azure Kubernetes Service (AKS). I extracted specific technologies such as Azure CNI, Cilium, Kubernetes, and eBPF. Key concepts include network policy enforcement, IP address management, and cluster observability. Microsoft products mentioned are Azure Kubernetes Service (AKS), Azure CLI, and Azure Virtual Network. The document provides comprehensive coverage of advanced networking capabilities, deployment methods, and limitations, along with practical command examples for setting up clusters with different networking models.",
    "main_topic": "Azure CNI Powered by Cilium",
    "technologies": [
      "Azure CNI",
      "Cilium",
      "Kubernetes",
      "eBPF",
      "Azure CLI",
      "Azure Virtual Network"
    ],
    "key_concepts": [
      "network policies",
      "IP address management",
      "observability",
      "overlay network",
      "virtual network",
      "CiliumEndpointSlices"
    ],
    "microsoft_products": [
      "Azure Kubernetes Service",
      "Azure CLI",
      "Azure Virtual Network"
    ],
    "document_type": "Technical Implementation Guide",
    "summary": "This document serves as a comprehensive guide for configuring Azure CNI Powered by Cilium in Azure Kubernetes Service (AKS). It outlines the integration of Azure CNI's control plane with Cilium's data plane to enhance networking performance and security. The guide details various methods for assigning pod IPs, the benefits of using eBPF for networking, and the enforcement of network policies without additional engines. It also discusses limitations, prerequisites, and provides command-line examples for creating AKS clusters. This resource is valuable for developers and system administrators looking to leverage advanced networking features in AKS environments.",
    "source": "https://learn.microsoft.com/en-us/azure/aks/azure-cni-powered-by-cilium"
  }
}